{
  "schema_version": 1,
  "generated_at": "2026-07-26T22:49:19Z",
  "lab_profile": {
    "id": "local",
    "display_name": "Local run (local)",
    "cpu_model": "Intel(R) Core(TM) i9-14900K",
    "physical_cores": 32,
    "logical_cores": 32,
    "os": "Linux 6.8.0-136-generic",
    "kernel": "6.8.0-136-generic",
    "memory_total_mb": 128572
  },
  "provenance": {
    "conduit_path": "target/release/conduit",
    "conduit_version": "unknown",
    "runner": "perf.runner/0.1.0",
    "loadgen": {
      "tool": "dnsperf",
      "mode": "docker",
      "image": "dnsconduit-dnsperf:2.14.0"
    },
    "git_sha": "f69d7d1a6ed789c238e7d0c1889dffef007c3fbb"
  },
  "quality": {
    "warmup_seconds": 2.0,
    "duration_seconds": 5.0
  },
  "scenarios": [
    {
      "id": "feature-tax-metrics-otlp-push-forward-fast",
      "suite": "feature_tax",
      "intent": "OTLP HTTP metrics push under forward_fast. Skips cleanly until\nconduit-otlp-metrics-tracer is available (Phase E); scrape ladder does not wait.",
      "status": "skip",
      "axes": {
        "runtime": "sync",
        "load_shape": "forward_fast",
        "obs_posture": "metrics_otlp_push",
        "ingress_workers": 2
      },
      "skip_reason": "conduit-otlp-metrics-tracer not available"
    }
  ]
}
