{
  "schema_version": 1,
  "generated_at": "2026-07-26T22:59:22Z",
  "lab_profile": {
    "id": "local",
    "display_name": "Local run (local)",
    "cpu_model": "Intel(R) Core(TM) i9-14900K",
    "physical_cores": 32,
    "logical_cores": 32,
    "os": "Linux 6.8.0-136-generic",
    "kernel": "6.8.0-136-generic",
    "memory_total_mb": 128572
  },
  "provenance": {
    "conduit_path": "target/release/conduit",
    "conduit_version": "unknown",
    "runner": "perf.runner/0.1.0",
    "loadgen": {
      "tool": "dnsperf",
      "mode": "docker",
      "image": "dnsconduit-dnsperf:2.14.0"
    },
    "git_sha": "f69d7d1a6ed789c238e7d0c1889dffef007c3fbb"
  },
  "quality": {
    "warmup_seconds": 2.0,
    "duration_seconds": 10.0
  },
  "scenarios": [
    {
      "id": "feature-tax-dnstap-full-forward-fast",
      "suite": "feature_tax",
      "intent": "Dnstap fuller emit (query, response, retry) under forward_fast with lab tracer.",
      "status": "ok",
      "axes": {
        "runtime": "sync",
        "load_shape": "forward_fast",
        "obs_posture": "dnstap_full",
        "ingress_workers": 2
      },
      "metrics": {
        "achieved_qps": 29091.288577,
        "queries_sent": 291028,
        "queries_completed": 291028,
        "queries_lost": 0,
        "latency_ms": {
          "avg": 3.431
        }
      },
      "quality": {
        "warmup_seconds": 2.0,
        "duration_seconds": 10.0
      }
    },
    {
      "id": "feature-tax-dnstap-off-forward-fast",
      "suite": "feature_tax",
      "intent": "Dnstap/events off (no sinks) under forward_fast \u2014 pair baseline for sampled/fuller.",
      "status": "ok",
      "axes": {
        "runtime": "sync",
        "load_shape": "forward_fast",
        "obs_posture": "dnstap_off",
        "ingress_workers": 2
      },
      "metrics": {
        "achieved_qps": 31959.819531,
        "queries_sent": 319709,
        "queries_completed": 319709,
        "queries_lost": 0,
        "latency_ms": {
          "avg": 3.1220000000000003
        }
      },
      "quality": {
        "warmup_seconds": 2.0,
        "duration_seconds": 10.0
      }
    },
    {
      "id": "feature-tax-dnstap-sampled-forward-fast",
      "suite": "feature_tax",
      "intent": "Dnstap sampled (~10 percent response frames) under forward_fast with lab tracer.",
      "status": "ok",
      "axes": {
        "runtime": "sync",
        "load_shape": "forward_fast",
        "obs_posture": "dnstap_sampled",
        "ingress_workers": 2
      },
      "metrics": {
        "achieved_qps": 57588.896965,
        "queries_sent": 576022,
        "queries_completed": 576022,
        "queries_lost": 0,
        "latency_ms": {
          "avg": 1.7309999999999999
        }
      },
      "quality": {
        "warmup_seconds": 2.0,
        "duration_seconds": 10.0
      }
    },
    {
      "id": "feature-tax-metrics-collect-emit-forward-fast",
      "suite": "feature_tax",
      "intent": "Collect+emit on standard base under forward_fast \u2014 paired with collect-only and\nno-collect for emit-path secondary comparison.",
      "status": "ok",
      "axes": {
        "runtime": "sync",
        "load_shape": "forward_fast",
        "obs_posture": "metrics_collect_emit",
        "ingress_workers": 2
      },
      "metrics": {
        "achieved_qps": 33165.703163,
        "queries_sent": 331782,
        "queries_completed": 331782,
        "queries_lost": 0,
        "latency_ms": {
          "avg": 3.009
        }
      },
      "quality": {
        "warmup_seconds": 2.0,
        "duration_seconds": 10.0
      }
    },
    {
      "id": "feature-tax-metrics-collect-only-forward-fast",
      "suite": "feature_tax",
      "intent": "Collect hot-path categories with emit false under forward_fast \u2014 records without\nscrape/OTLP export. Paired with collect+emit and no-collect.",
      "status": "ok",
      "axes": {
        "runtime": "sync",
        "load_shape": "forward_fast",
        "obs_posture": "metrics_collect_only",
        "ingress_workers": 2
      },
      "metrics": {
        "achieved_qps": 29815.162542,
        "queries_sent": 298338,
        "queries_completed": 298338,
        "queries_lost": 0,
        "latency_ms": {
          "avg": 3.346
        }
      },
      "quality": {
        "warmup_seconds": 2.0,
        "duration_seconds": 10.0
      }
    },
    {
      "id": "feature-tax-metrics-minimal-scrape-forward-fast",
      "suite": "feature_tax",
      "intent": "Metrics base minimal with Prometheus scrape (collect+emit) under forward_fast.\nLadder cell between metrics-off and standard scrape.",
      "status": "ok",
      "axes": {
        "runtime": "sync",
        "load_shape": "forward_fast",
        "obs_posture": "metrics_minimal_scrape",
        "ingress_workers": 2
      },
      "metrics": {
        "achieved_qps": 29806.6253,
        "queries_sent": 298338,
        "queries_completed": 298338,
        "queries_lost": 0,
        "latency_ms": {
          "avg": 3.347
        }
      },
      "quality": {
        "warmup_seconds": 2.0,
        "duration_seconds": 10.0
      }
    },
    {
      "id": "feature-tax-metrics-no-collect-forward-fast",
      "suite": "feature_tax",
      "intent": "No-collect on hot-path categories under forward_fast \u2014 neither record nor export\nfor volume/failures/lookup/timing. Paired with collect-only and collect+emit.",
      "status": "ok",
      "axes": {
        "runtime": "sync",
        "load_shape": "forward_fast",
        "obs_posture": "metrics_no_collect",
        "ingress_workers": 2
      },
      "metrics": {
        "achieved_qps": 26258.689537,
        "queries_sent": 262684,
        "queries_completed": 262684,
        "queries_lost": 0,
        "latency_ms": {
          "avg": 3.8
        }
      },
      "quality": {
        "warmup_seconds": 2.0,
        "duration_seconds": 10.0
      }
    },
    {
      "id": "feature-tax-metrics-off-forward-fast",
      "suite": "feature_tax",
      "intent": "Observability-off baseline under forward_fast \u2014 metrics disabled, no dnstap sinks.\nLadder pair for minimal/standard scrape tax deltas.",
      "status": "ok",
      "axes": {
        "runtime": "sync",
        "load_shape": "forward_fast",
        "obs_posture": "metrics_off",
        "ingress_workers": 2
      },
      "metrics": {
        "achieved_qps": 48070.649832,
        "queries_sent": 480841,
        "queries_completed": 480841,
        "queries_lost": 0,
        "latency_ms": {
          "avg": 2.075
        }
      },
      "quality": {
        "warmup_seconds": 2.0,
        "duration_seconds": 10.0
      }
    },
    {
      "id": "feature-tax-metrics-otlp-push-forward-fast",
      "suite": "feature_tax",
      "intent": "OTLP HTTP metrics push under forward_fast. Skips cleanly until\nconduit-otlp-metrics-tracer is available (Phase E); scrape ladder does not wait.",
      "status": "skip",
      "axes": {
        "runtime": "sync",
        "load_shape": "forward_fast",
        "obs_posture": "metrics_otlp_push",
        "ingress_workers": 2
      },
      "skip_reason": "conduit-otlp-metrics-tracer not available"
    },
    {
      "id": "feature-tax-metrics-standard-dnstap-full-forward-fast",
      "suite": "feature_tax",
      "intent": "Combined tax \u2014 metrics standard scrape plus fuller dnstap under forward_fast.",
      "status": "ok",
      "axes": {
        "runtime": "sync",
        "load_shape": "forward_fast",
        "obs_posture": "metrics_standard_dnstap_full",
        "ingress_workers": 2
      },
      "metrics": {
        "achieved_qps": 26466.026671,
        "queries_sent": 264706,
        "queries_completed": 264706,
        "queries_lost": 0,
        "latency_ms": {
          "avg": 3.7720000000000002
        }
      },
      "quality": {
        "warmup_seconds": 2.0,
        "duration_seconds": 10.0
      }
    },
    {
      "id": "feature-tax-metrics-standard-scrape-forward-fast",
      "suite": "feature_tax",
      "intent": "Metrics base standard with Prometheus scrape (collect+emit) under forward_fast.\nScrape-only ladder top; also the collect+emit pole of the collect pair.",
      "status": "ok",
      "axes": {
        "runtime": "sync",
        "load_shape": "forward_fast",
        "obs_posture": "metrics_standard_scrape",
        "ingress_workers": 2
      },
      "metrics": {
        "achieved_qps": 22750.419494,
        "queries_sent": 227670,
        "queries_completed": 227670,
        "queries_lost": 0,
        "latency_ms": {
          "avg": 4.386
        }
      },
      "quality": {
        "warmup_seconds": 2.0,
        "duration_seconds": 10.0
      }
    }
  ]
}
