{
  "schema_version": 1,
  "generated_at": "2026-07-26T23:28:09Z",
  "lab_profile": {
    "id": "local",
    "display_name": "Local run (local)",
    "cpu_model": "Intel(R) Core(TM) i9-14900K",
    "physical_cores": 32,
    "logical_cores": 32,
    "os": "Linux 6.8.0-136-generic",
    "kernel": "6.8.0-136-generic",
    "memory_total_mb": 128572
  },
  "provenance": {
    "conduit_path": "target/release/conduit",
    "conduit_version": "unknown",
    "runner": "perf.runner/0.1.0",
    "loadgen": {
      "tool": "dnsperf",
      "mode": "docker",
      "image": "dnsconduit-dnsperf:2.14.0"
    },
    "git_sha": "6d027903c6c4d18d24dc15093ba7705a75999239"
  },
  "quality": {
    "warmup_seconds": 2.0,
    "duration_seconds": 8.0
  },
  "scenarios": [
    {
      "id": "feature-tax-metrics-otlp-push-forward-fast",
      "suite": "feature_tax",
      "intent": "OTLP HTTP metrics push under forward_fast. Requires conduit-otlp-metrics-tracer;\nrecords secondary otlp_accepts / otlp_failures from the lab receiver.",
      "status": "ok",
      "axes": {
        "runtime": "sync",
        "load_shape": "forward_fast",
        "obs_posture": "metrics_otlp_push",
        "ingress_workers": 2
      },
      "metrics": {
        "achieved_qps": 33442.741659,
        "queries_sent": 267868,
        "queries_completed": 267868,
        "queries_lost": 0,
        "latency_ms": {
          "avg": 2.983
        }
      },
      "quality": {
        "warmup_seconds": 2.0,
        "duration_seconds": 8.0
      },
      "secondary": {
        "otlp_accepts": 6,
        "otlp_failures": 0
      }
    }
  ]
}
