{
  "schema_version": 1,
  "generated_at": "2026-07-26T22:59:26Z",
  "lab_profile": {
    "id": "local",
    "display_name": "Local run (local)",
    "cpu_model": "Intel(R) Core(TM) i9-14900K",
    "physical_cores": 32,
    "logical_cores": 32,
    "os": "Linux 6.8.0-136-generic",
    "kernel": "6.8.0-136-generic",
    "memory_total_mb": 128572
  },
  "provenance": {
    "conduit_path": "target/release/conduit",
    "conduit_version": "unknown",
    "runner": "perf.runner/0.1.0",
    "loadgen": {
      "tool": "dnsperf",
      "mode": "docker",
      "image": "dnsconduit-dnsperf:2.14.0"
    },
    "git_sha": "f69d7d1a6ed789c238e7d0c1889dffef007c3fbb"
  },
  "quality": {
    "warmup_seconds": 2.0,
    "duration_seconds": 10.0
  },
  "scenarios": [
    {
      "id": "lifecycle-cold-start",
      "suite": "lifecycle",
      "intent": "Cold-start wall time from process start to first successful DNS answer.",
      "status": "ok",
      "axes": {
        "runtime": "sync",
        "load_shape": "forward_fast",
        "obs_posture": "metrics_off",
        "ingress_workers": 2
      },
      "metrics": {
        "cold_start_ms": 404.574
      },
      "quality": {
        "warmup_seconds": 2.0
      }
    },
    {
      "id": "lifecycle-config-apply",
      "suite": "lifecycle",
      "intent": "Config apply latency via conduitctl apply sparse overlay (logging level).\nThin lifecycle cell; not required for curated publish spine.",
      "status": "ok",
      "axes": {
        "runtime": "sync",
        "load_shape": "forward_fast",
        "obs_posture": "metrics_off",
        "ingress_workers": 2
      },
      "metrics": {
        "apply_latency_ms": 16.44
      },
      "quality": {
        "warmup_seconds": 2.0
      }
    }
  ]
}
