{
  "schema_version": 1,
  "generated_at": "2026-07-26T21:50:20Z",
  "lab_profile": {
    "id": "local",
    "display_name": "Local run (local)",
    "cpu_model": "Intel(R) Core(TM) i9-14900K",
    "physical_cores": 32,
    "logical_cores": 32,
    "os": "Linux 6.8.0-136-generic",
    "kernel": "6.8.0-136-generic"
  },
  "provenance": {
    "conduit_path": "/home/egon/git_repos/DNSConduit/target/release/conduit",
    "conduit_version": "unknown",
    "runner": "perf.runner/0.1.0",
    "loadgen": {
      "tool": "dnsperf",
      "mode": "docker",
      "image": "dnsconduit-dnsperf:2.14.0"
    },
    "git_sha": "95bc4f59ea5cd9f89aabb55f42939c2c170c83b6"
  },
  "quality": {
    "warmup_seconds": 2.0,
    "duration_seconds": 5.0
  },
  "scenarios": [
    {
      "id": "shutdown-drain-budgeted-forward-slow",
      "suite": "shutdown_drain",
      "intent": "Drain-budgeted policy (short drain_timeout_ms) under forward_slow load.\nRecords drain duration and client loss during the stop window. Paired with\ncomplete and minimal policies for relative comparison.",
      "status": "ok",
      "axes": {
        "runtime": "sync",
        "load_shape": "forward_slow",
        "drain_policy": "drain_budgeted",
        "ingress_workers": 2
      },
      "metrics": {
        "achieved_qps": 4.999939,
        "queries_sent": 240,
        "queries_completed": 40,
        "queries_lost": 200,
        "latency_ms": {
          "avg": 1026.7839999999999
        },
        "drain_duration_ms": 163.736
      },
      "quality": {
        "warmup_seconds": 2.0,
        "duration_seconds": 8.0,
        "notes": "shutdown under load: establish_load_s=2.0, stop_wait_s=10.0"
      },
      "secondary": {
        "client_failures_during_stop": 200
      }
    }
  ]
}
